{
  "$schema": "https://raw.githubusercontent.com/FrancescoBortot/UniAIBench-public/v1.0/benchmark-toolkit/schemas/rubric.schema.json",
  "rubric_version": "1.0",
  "judge_spec_version": "1.0",
  "item_id": "<ITEM_ID>",
  "subject": "<SUBJECT>",
  "domain_profile": {
    "discipline": "<DISCIPLINE>",
    "topic": "<TOPIC>",
    "task_type": "<TASK_TYPE>",
    "domain_specific_fields": {}
  },
  "created_without_model_answers": true,
  "frozen": false,
  "reference_status": "unverified",
  "reference_notes": "",
  "subproblems": [
    {
      "id": "<SUBPROBLEM_ID>",
      "weight": 1.0,
      "request": "<WHAT_THE_ITEM_REQUESTS>",
      "expected_results": [],
      "required_conditions": [],
      "accepted_equivalences": [],
      "accepted_alternative_methods": []
    }
  ],
  "atomic_criteria": [],
  "dimension_applicability": {
    "T1": "applicable",
    "T2": "applicable",
    "T3": "applicable",
    "T4": "applicable",
    "T5": "applicable",
    "T6": "applicable",
    "T7": "applicable",
    "T8": "applicable"
  },
  "dimension_point_budget": {
    "T1": 20,
    "T2": 15,
    "T3": 20,
    "T4": 15,
    "T5": 10,
    "T6": 8,
    "T7": 7,
    "T8": 5
  },
  "rubric_specific_caps": [],
  "human_review_triggers": [],
  "human_approval": {
    "approved": false,
    "reviewer": "",
    "date": ""
  }
}
